Image,url,title,date_sold,price_in_US,shipping_cost,converted_price,profit,ROI,brand,cost
https://i.ebayimg.com/images/g/hHMAAOSwt69jNkYs/s-l1200.jpg,https://www.ebay.com/itm/144743765006?nordt=true&orig_cvip=true&rt=nc,sog sogzilla folding lockback  knife all black with clip discontinued,2022-10-26,24.99,5.85,30.839999999999996,12.839999999999996,85.59999999999998,sog,15.0
https://i.ebayimg.com/images/g/KfEAAOSwVQ5jUW13/s-l1200.jpg,https://www.ebay.com/itm/144775254675?nordt=true&orig_cvip=true&rt=nc,sog  twitch xl wood pocket knife,2022-10-26,38.0,0.0,38.0,20.0,133.33333333333331,sog,15.0
https://i.ebayimg.com/images/g/1DkAAOSwLGVjQeya/s-l1200.jpg,https://www.ebay.com/itm/334598990831?nordt=true&orig_cvip=true&rt=nc,sog usa made black powerlock knife tool multitool + gerber acu molle sheath,2022-10-26,21.0,10.0,31.0,13.0,86.66666666666667,sog,15.0
https://i.ebayimg.com/images/g/T2EAAOSwkWVjUKF4/s-l1200.jpg,https://www.ebay.com/itm/144774446385?nordt=true&orig_cvip=true&rt=nc,sog fusion micron ii lock blade tanto folding knife free u.s. shipping,2022-10-26,15.0,19.2,34.2,16.200000000000003,108.00000000000003,sog,15.0
https://i.ebayimg.com/images/g/eo8AAOSwErJjUsSX/s-l1200.jpg,https://www.ebay.com/itm/285009977333?nordt=true&orig_cvip=true&rt=nc,"sog trident folding knife 3.7"" combo blade, g10 handles #r34",2022-10-26,22.5,8.0,30.5,12.5,83.33333333333334,sog,15.0
https://i.ebayimg.com/images/g/R5EAAOSwQgVjTsXk/s-l1200.jpg,https://www.ebay.com/itm/225211075336?nordt=true&orig_cvip=true&rt=nc,sog pentagon elite 1 japan arc lock folding pocket knife,2022-10-26,150.0,20.0,170.0,152.0,1013.3333333333333,sog,15.0
https://i.ebayimg.com/images/g/BNYAAOSwNT1jUF~f/s-l1200.jpg,https://www.ebay.com/itm/394295536594?nordt=true&orig_cvip=true&rt=nc,sog flash tanto ( it says) assisted open knife plain edge tanto blade liner lock,2022-10-26,62.0,0.0,62.0,44.0,293.3333333333333,sog,15.0
https://i.ebayimg.com/images/g/J7cAAOSwrI9jWXOh/s-l1200.jpg,https://www.ebay.com/itm/275515976908?nordt=true&orig_cvip=true&rt=nc,fusion knife by sog,2022-10-26,9.99,9.43,19.42,1.4200000000000017,9.466666666666677,sog,15.0
https://i.ebayimg.com/images/g/I6QAAOSwTGFjMwxo/s-l1200.jpg,https://www.ebay.com/itm/314164411282?nordt=true&orig_cvip=true&rt=nc,"sog flash ii assisted pocket knife folding blade combo edge 3.5"" blade stainless",2022-10-26,39.96,0.0,39.96,21.96,146.4,sog,15.0
https://i.ebayimg.com/images/g/J0EAAOSwIZZjPZv-/s-l1200.jpg,https://www.ebay.com/itm/255779213516?nordt=true&orig_cvip=true&rt=nc,used sog sogzilla pocket knife,2022-10-26,20.5,4.25,24.75,6.75,45.0,sog,15.0
https://i.ebayimg.com/images/g/vfQAAOSwVJ9jTXSx/s-l1200.jpg,https://www.ebay.com/itm/185621912123?nordt=true&orig_cvip=true&rt=nc,sog trident folding knife | barely used | tiger stripe |  sog-tf3-cp,2022-10-26,65.0,0.0,65.0,47.0,313.3333333333333,sog,15.0
https://i.ebayimg.com/images/g/iOwAAOSwMtJjUllk/s-l1200.jpg,https://www.ebay.com/itm/354346896578?nordt=true&orig_cvip=true&rt=nc,"sog flash ii black tanto plain edge, spring assisted, safety switch pocket knife",2022-10-26,35.0,6.1,41.1,23.1,154.0,sog,15.0
https://i.ebayimg.com/images/g/jpcAAOSwvjNi1dSb/s-l1200.jpg,https://www.ebay.com/itm/175356010588?nordt=true&orig_cvip=true&rt=nc,sog salute mini folding pocket knife lockback plain edge black g10 stainless,2022-10-26,17.0,0.0,17.0,-1.0,-6.666666666666667,sog,15.0
https://i.ebayimg.com/images/g/ZOoAAOSwYa5jT3QP/s-l1200.jpg,https://www.ebay.com/itm/403947835175?nordt=true&orig_cvip=true&rt=nc,"15 knife keychains/advertising keychains lot (volkswagen, sog, swiss army)",2022-10-25,31.0,0.0,31.0,13.0,86.66666666666667,sog,15.0
https://i.ebayimg.com/images/g/OJMAAOSwMqljT2VO/s-l1200.jpg,https://www.ebay.com/itm/334597852325?nordt=true&orig_cvip=true&rt=nc,rare/discontinued sog flash i assisted open plain edge folding pocket knife����,2022-10-25,50.0,4.06,54.06,36.06,240.40000000000003,sog,15.0
https://i.ebayimg.com/images/g/sGwAAOSwR9VjSe4v/s-l1200.jpg,https://www.ebay.com/itm/385171823330?nordt=true&orig_cvip=true&rt=nc,rare and discontinued sog pentagon elite knife,2022-10-25,159.0,0.0,159.0,141.0,940.0,sog,15.0
https://i.ebayimg.com/images/g/Ua8AAOSwkDVjT1lj/s-l1200.jpg,https://www.ebay.com/itm/394294339800?nordt=true&orig_cvip=true&rt=nc,sog keytron key ring knife plain edge blade lockback,2022-10-25,13.5,0.0,13.5,-4.5,-30.0,sog,15.0
https://i.ebayimg.com/images/g/uQgAAOSwy-ljTvI0/s-l1200.jpg,https://www.ebay.com/itm/255782932844?nordt=true&orig_cvip=true&rt=nc,used sog trident pocket knife,2022-10-25,34.0,4.25,38.25,20.25,135.0,sog,15.0
https://i.ebayimg.com/images/g/8uYAAOSwHR1jSvlT/s-l1200.jpg,https://www.ebay.com/itm/125572036444?nordt=true&orig_cvip=true&rt=nc,sog flash ii assisted folding pocket knife,2022-10-25,20.5,5.5,26.0,8.0,53.333333333333336,sog,15.0
https://i.ebayimg.com/images/g/9joAAOSwdDdjKe3P/s-l1200.jpg,https://www.ebay.com/itm/165731294698?nordt=true&orig_cvip=true&rt=nc,"sog specialty auto clip lockback black folding pocket clip knife 4"" blade",2022-10-25,25.0,8.0,33.0,15.0,100.0,sog,15.0
https://i.ebayimg.com/images/g/L1sAAOSwujBjVpYD/s-l1200.jpg,https://www.ebay.com/itm/334603895949?nordt=true&orig_cvip=true&rt=nc,sog trident black combo edge folding pocket knife assisted w/ seat belt cutter,2022-10-25,30.0,5.99,35.99,17.990000000000002,119.93333333333334,sog,15.0
https://i.ebayimg.com/images/g/hHEAAOSwG4JjStmp/s-l1200.jpg,https://www.ebay.com/itm/255777820367?nordt=true&orig_cvip=true&rt=nc,used sog fielder pocket knife,2022-10-25,11.5,0.0,11.5,-6.5,-43.333333333333336,sog,15.0
https://i.ebayimg.com/images/g/h0YAAOSwqGxjStk8/s-l1200.jpg,https://www.ebay.com/itm/255777817761?nordt=true&orig_cvip=true&rt=nc,used sog trident pocket knife,2022-10-25,20.5,4.25,24.75,6.75,45.0,sog,15.0
https://i.ebayimg.com/images/g/hlkAAOSwLR1i8p8E/s-l1200.jpg,https://www.ebay.com/itm/204064923790?nordt=true&orig_cvip=true&rt=nc,sog quake micarta a/o assisted s30v knife *test model never produced factory new,2022-10-24,209.0,4.9,213.9,195.9,1306.0,sog,15.0
https://i.ebayimg.com/images/g/5O0AAOSwS5JjOxMr/s-l1200.jpg,https://www.ebay.com/itm/364019297718?nordt=true&orig_cvip=true&rt=nc,sog stainless steel silver slim jim folding knife with blade lock and clip,2022-10-24,60.75,10.89,71.64,53.64,357.6,sog,15.0
https://i.ebayimg.com/images/g/R48AAOSwt8RjTgys/s-l1200.jpg,https://www.ebay.com/itm/394292827421?nordt=true&orig_cvip=true&rt=nc,sog micro dot knife lockback plain edge blade seki japan,2022-10-24,34.0,0.0,34.0,16.0,106.66666666666667,sog,15.0
https://i.ebayimg.com/images/g/2fwAAOSwwoJjShOe/s-l1200.jpg,https://www.ebay.com/itm/255776877122?nordt=true&orig_cvip=true&rt=nc,used sog twitch 2 pocket knife,2022-10-24,21.5,4.25,25.75,7.75,51.66666666666667,sog,15.0
https://i.ebayimg.com/images/g/rOsAAOSwHABjRrjA/s-l1200.jpg,https://www.ebay.com/itm/255793718490?nordt=true&orig_cvip=true&rt=nc,sog micron ii small pocket keychain knife! lot of 2!,2022-10-24,23.97,0.0,23.97,5.969999999999999,39.79999999999999,sog,15.0
https://i.ebayimg.com/images/g/rOsAAOSwHABjRrjA/s-l1200.jpg,https://www.ebay.com/itm/265932308445?nordt=true&orig_cvip=true&rt=nc,sog micron ii small pocket keychain knife! lot of 2!,2022-10-24,23.97,0.0,23.97,5.969999999999999,39.79999999999999,sog,15.0
https://i.ebayimg.com/images/g/lKkAAOSwJ9pjTgMf/s-l1200.jpg,https://www.ebay.com/itm/125567463844?nordt=true&orig_cvip=true&rt=nc,sog poweraccess multi-tool compound interest eod mut pocket knife folding pliers,2022-10-24,32.0,2.0,34.0,16.0,106.66666666666667,sog,15.0
https://i.ebayimg.com/images/g/bVcAAOSwjMljTe1G/s-l1200.jpg,https://www.ebay.com/itm/255781618630?nordt=true&orig_cvip=true&rt=nc,used sog flare pocket knife,2022-10-24,15.5,4.25,19.75,1.75,11.666666666666666,sog,15.0
https://i.ebayimg.com/images/g/CUYAAOSwMopjTeqX/s-l1200.jpg,https://www.ebay.com/itm/255781604945?nordt=true&orig_cvip=true&rt=nc,used sog slimjim pocket knife,2022-10-24,23.5,4.25,27.75,9.75,65.0,sog,15.0
https://i.ebayimg.com/images/g/1m4AAOSwF1FjR0-2/s-l1200.jpg,https://www.ebay.com/itm/304668114641?nordt=true&orig_cvip=true&rt=nc,sog knife,2022-10-24,8.0,6.6,14.6,-3.4000000000000004,-22.666666666666668,sog,15.0
https://i.ebayimg.com/images/g/N-8AAOSwDzhi4q7I/s-l1200.jpg,https://www.ebay.com/itm/295116965322?nordt=true&orig_cvip=true&rt=nc,"sog micron ii qad 2 1/8"" plain edge black pocket knife mid lock w/keychain hole",2022-10-24,22.49,19.2,41.69,23.689999999999998,157.93333333333334,sog,15.0
https://i.ebayimg.com/images/g/ndYAAOSw07JjTar6/s-l1200.jpg,https://www.ebay.com/itm/234739067706?nordt=true&orig_cvip=true&rt=nc,sog sogwinder i specialty seki japan folding lockback pocket knife,2022-10-24,100.0,10.0,110.0,92.0,613.3333333333334,sog,15.0
https://i.ebayimg.com/images/g/ousAAOSwzkBiyx0E/s-l1200.jpg,https://www.ebay.com/itm/394157578804?nordt=true&orig_cvip=true&rt=nc,sog keytron key ring knife plain edge blade lockback,2022-10-24,18.0,0.0,18.0,0.0,0.0,sog,15.0
https://i.ebayimg.com/images/g/sYUAAOSwTFtjSy~k/s-l1200.jpg,https://www.ebay.com/itm/144768995455?nordt=true&orig_cvip=true&rt=nc,sog trident at cryo d2 studies and observations group folding pocket knife,2022-10-23,26.0,4.25,30.25,12.25,81.66666666666667,sog,15.0
https://i.ebayimg.com/images/g/Gx8AAOSwBRhjT0~m/s-l1200.jpg,https://www.ebay.com/itm/125569054821?nordt=true&orig_cvip=true&rt=nc,black sog powerlock multi-tool compound interest eod mut pocket knife pliers,2022-10-23,17.5,2.0,19.5,1.5,10.0,sog,15.0
https://i.ebayimg.com/images/g/JfAAAOSw4JNjTKYl/s-l1200.jpg,https://www.ebay.com/itm/125565878877?nordt=true&orig_cvip=true&rt=nc,"sog aegis tango knife, approx. 4” black blade, assisted opening, used",2022-10-23,30.0,10.0,40.0,22.0,146.66666666666666,sog,15.0
https://i.ebayimg.com/images/g/wh4AAOSwIfRjSEF1/s-l1200.png,https://www.ebay.com/itm/225204267353?nordt=true&orig_cvip=true&rt=nc,"(7) knives,  sog  key ,dewalt, husky,  true utility pocket knife",2022-10-23,12.5,6.99,19.490000000000002,1.490000000000002,9.933333333333346,sog,15.0
https://i.ebayimg.com/images/g/jxgAAOSwBZhjTIi3/s-l1200.jpg,https://www.ebay.com/itm/155211226451?nordt=true&orig_cvip=true&rt=nc,sog slim jim folding knife,2022-10-23,19.99,0.0,19.99,1.9899999999999984,13.266666666666657,sog,15.0
https://i.ebayimg.com/images/g/qx4AAOSw3HdjQ03s/s-l1200.jpg,https://www.ebay.com/itm/354337799845?nordt=true&orig_cvip=true&rt=nc,sog flash 2 assisted open tactical edc pocket knife black handle!,2022-10-23,35.0,5.5,40.5,22.5,150.0,sog,15.0
https://i.ebayimg.com/images/g/S4kAAOSwQrRjOwkG/s-l1200.jpg,https://www.ebay.com/itm/155190484886?nordt=true&orig_cvip=true&rt=nc,sog flash ii assisted folding pocket knife,2022-10-23,39.99,5.85,45.84,27.840000000000003,185.60000000000002,sog,15.0
https://i.ebayimg.com/images/g/aMYAAOSwy5JjTH4y/s-l1200.png,https://www.ebay.com/itm/115568014915?nordt=true&orig_cvip=true&rt=nc,"sog twitch ii folding knife, black",2022-10-23,29.0,5.0,34.0,16.0,106.66666666666667,sog,15.0
https://i.ebayimg.com/images/g/am0AAOSwYaBjMRaE/s-l1200.jpg,https://www.ebay.com/itm/204102699441?nordt=true&orig_cvip=true&rt=nc,sog specialty knives 4034 twitch ii lockback folding knife pocketjack survival,2022-10-23,24.99,0.0,24.99,6.989999999999998,46.599999999999994,sog,15.0
https://i.ebayimg.com/images/g/zGMAAOSwhKRjFNHC/s-l1200.jpg,https://www.ebay.com/itm/374240935398?nordt=true&orig_cvip=true&rt=nc,"rare-discontinued sog autoclip folding pocket knife 3"" blade b1238",2022-10-23,30.0,0.0,30.0,12.0,80.0,sog,15.0
https://i.ebayimg.com/images/g/rS8AAOSwftFjTt-6/s-l1200.jpg,https://www.ebay.com/itm/185623366293?nordt=true&orig_cvip=true&rt=nc,"sog ultra xr folding knife 2.88"" cpm s35vn stainless blade carbon fiber handle",2022-10-23,82.0,5.85,87.85,69.85,465.66666666666663,sog,15.0
https://i.ebayimg.com/images/g/EecAAOSwaBFjMRiV/s-l1200.jpg,https://www.ebay.com/itm/204102703394?nordt=true&orig_cvip=true&rt=nc,black sog trident folding pocket knife used a,2022-10-23,34.99,0.0,34.99,16.990000000000002,113.26666666666667,sog,15.0
https://i.ebayimg.com/images/g/WRYAAOSw9RlirjHZ/s-l1200.jpg,https://www.ebay.com/itm/134180104579?nordt=true&orig_cvip=true&rt=nc,vintage sog specialty knives sog folding knife seki-city japan.,2022-10-23,122.0,4.0,126.0,108.0,720.0,sog,15.0
https://i.ebayimg.com/images/g/OV8AAOSwmLljTgF9/s-l1200.jpg,https://www.ebay.com/itm/394292773985?nordt=true&orig_cvip=true&rt=nc,sog salute mini pocket knife lockback plain edge blade,2022-10-23,19.0,0.0,19.0,1.0,6.666666666666667,sog,15.0
https://i.ebayimg.com/images/g/dEoAAOSwRiRjTp87/s-l1200.jpg,https://www.ebay.com/itm/304666319938?nordt=true&orig_cvip=true&rt=nc,sog zoom pocket knife assisted opening plain edge black aluminum handle,2022-10-23,46.0,6.55,52.55,34.55,230.33333333333331,sog,15.0
https://i.ebayimg.com/images/g/36EAAOSw9r9jLESn/s-l1200.jpg,https://www.ebay.com/itm/115576285740?nordt=true&orig_cvip=true&rt=nc,sog trident black combo edge folding pocket knife assisted w/ seat belt cutter,2022-10-23,26.0,5.5,31.5,13.5,90.0,sog,15.0
https://i.ebayimg.com/images/g/U3IAAOSwTmxjUEVn/s-l1200.jpg,https://www.ebay.com/itm/285007677919?nordt=true&orig_cvip=true&rt=nc,sog flash ii assisted open knife combo edge tanto blade arc lock,2022-10-22,60.0,0.0,60.0,42.0,280.0,sog,15.0
https://i.ebayimg.com/images/g/lZ0AAOSwuSFjRDBU/s-l1200.jpg,https://www.ebay.com/itm/374299001845?nordt=true&orig_cvip=true&rt=nc,rare seki japan sog tomcat lock back folding pocket knife c3,2022-10-22,249.95,0.0,249.95,231.95,1546.3333333333333,sog,15.0
https://i.ebayimg.com/images/g/IDgAAOSwBSNjS1di/s-l1200.jpg,https://www.ebay.com/itm/175451648089?nordt=true&orig_cvip=true&rt=nc,sog salute mini pocket knife lockback plain edge blade,2022-10-22,13.5,5.85,19.35,1.3500000000000014,9.000000000000009,sog,15.0
https://i.ebayimg.com/images/g/gboAAOSwqmJjVHVy/s-l1200.jpg,https://www.ebay.com/itm/275511003777?nordt=true&orig_cvip=true&rt=nc,"used knife lot - case,  buck , gerber, sog, kershaw, mtech, smith & wesson, uzi",2022-10-22,44.0,21.5,65.5,47.5,316.66666666666663,sog,15.0
https://i.ebayimg.com/images/g/xTkAAOSw4n5jS0p-/s-l1200.jpg,https://www.ebay.com/itm/255778339326?nordt=true&orig_cvip=true&rt=nc,sog fielder tactical knife - new very cool design -  take a look!,2022-10-22,10.99,5.85,16.84,-1.1600000000000001,-7.733333333333333,sog,15.0
https://i.ebayimg.com/images/g/jVUAAOSwn91i2Zaq/s-l1200.jpg,https://www.ebay.com/itm/354179138001?nordt=true&orig_cvip=true&rt=nc,sog escape pocket knife combo edge blade lockback,2022-10-22,25.0,0.0,25.0,7.0,46.666666666666664,sog,15.0
https://i.ebayimg.com/images/g/NDwAAOSwXZZjEnns/s-l1200.png,https://www.ebay.com/itm/255778055172?nordt=true&orig_cvip=true&rt=nc,sog salute knife,2022-10-22,24.95,6.0,30.95,12.95,86.33333333333333,sog,15.0
https://i.ebayimg.com/images/g/Tc8AAOSwieJil6Nz/s-l1200.jpg,https://www.ebay.com/itm/363951679150?nordt=true&orig_cvip=true&rt=nc,sog salute mini knife - black,2022-10-22,13.0,4.0,17.0,-1.0,-6.666666666666667,sog,15.0
https://i.ebayimg.com/images/g/T7AAAOSwAZtjTTQq/s-l1200.jpg,https://www.ebay.com/itm/134284574000?nordt=true&orig_cvip=true&rt=nc,#627 black sog flare assisted opening gfn piston lock knife,2022-10-22,18.0,0.0,18.0,0.0,0.0,sog,15.0
https://i.ebayimg.com/images/g/iHUAAOSwK~FjUdQj/s-l1200.jpg,https://www.ebay.com/itm/255786790497?nordt=true&orig_cvip=true&rt=nc,sog flare assisted folding pocket knife!,2022-10-22,23.0,0.0,23.0,5.0,33.33333333333333,sog,15.0
https://i.ebayimg.com/images/g/fOUAAOSwvydjTDkN/s-l1200.jpg,https://www.ebay.com/itm/185620774493?nordt=true&orig_cvip=true&rt=nc,"sog aegis ae-02 folding knife assisted 3.5"" black tini plain blade ae02",2022-10-22,50.0,6.6,56.6,38.6,257.3333333333333,sog,15.0
https://i.ebayimg.com/images/g/koMAAOSwHPZjP5u1/s-l1200.jpg,https://www.ebay.com/itm/204112895317?nordt=true&orig_cvip=true&rt=nc,black sog trident folding pocket knife used d,2022-10-22,34.99,0.0,34.99,16.990000000000002,113.26666666666667,sog,15.0
https://i.ebayimg.com/images/g/whgAAOSwXyZjUtoL/s-l1200.jpg,https://www.ebay.com/itm/394298478491?nordt=true&orig_cvip=true&rt=nc,sog trident assisted open knife combo edge blade arc lock (fvs012333),2022-10-21,42.99,0.0,42.99,24.990000000000002,166.60000000000002,sog,15.0
https://i.ebayimg.com/images/g/KdkAAOSw3OVjO7~K/s-l1200.jpg,https://www.ebay.com/itm/175450713993?nordt=true&orig_cvip=true&rt=nc,sog vulcan pocket knife - seki-japan vg-10 plain blade arc lock black handle,2022-10-21,86.0,6.1,92.1,74.1,493.99999999999994,sog,15.0
https://i.ebayimg.com/images/g/MCUAAOSwqgFjJ4-e/s-l1200.jpg,https://www.ebay.com/itm/394248931948?nordt=true&orig_cvip=true&rt=nc,sog fielder folding knife with pocket clip & black g10 handle,2022-10-21,15.0,0.0,15.0,-3.0,-20.0,sog,15.0
https://i.ebayimg.com/images/g/890AAOSwRAtjF7bl/s-l1200.jpg,https://www.ebay.com/itm/115559775263?nordt=true&orig_cvip=true&rt=nc,sog slimjim lockback knife,2022-10-21,24.0,5.85,29.85,11.850000000000001,79.00000000000001,sog,15.0
https://i.ebayimg.com/images/g/xiUAAOSwlJBjRazI/s-l1200.jpg,https://www.ebay.com/itm/403934332046?nordt=true&orig_cvip=true&rt=nc,"sog twitch ii assisted flipper pocket knife (2.65"" satin plain blade)",2022-10-21,30.0,5.0,35.0,17.0,113.33333333333333,sog,15.0
https://i.ebayimg.com/images/g/8NEAAOSw93NjUhJC/s-l1200.jpg,https://www.ebay.com/itm/195425650348?nordt=true&orig_cvip=true&rt=nc,sog  blink assisted lockback pocket knife with box,2022-10-21,59.99,5.85,65.84,47.84,318.93333333333334,sog,15.0
https://i.ebayimg.com/images/g/J0sAAOSwbcJjRaq2/s-l1200.jpg,https://www.ebay.com/itm/403934325203?nordt=true&orig_cvip=true&rt=nc,sog kiku knife,2022-10-21,100.0,6.0,106.0,88.0,586.6666666666666,sog,15.0
https://i.ebayimg.com/images/g/hWYAAOSwN-VjSQHN/s-l1200.jpg,https://www.ebay.com/itm/385170507802?nordt=true&orig_cvip=true&rt=nc,"sog flare sat folding knife 3.5"" 8cr13mov steel blade black grn handle",2022-10-20,9.99,7.4,17.39,-0.6099999999999994,-4.066666666666663,sog,15.0
https://i.ebayimg.com/images/g/7OAAAOSwS1ZjRP9Y/s-l1200.jpg,https://www.ebay.com/itm/325379019036?nordt=true&orig_cvip=true&rt=nc,sog flash ii tanto black pocket knife assisted silver combo tanto blade,2022-10-20,59.99,3.99,63.980000000000004,45.980000000000004,306.53333333333336,sog,15.0
https://i.ebayimg.com/images/g/Vs4AAOSwFC1jS4gF/s-l1200.jpg,https://www.ebay.com/itm/225207546395?nordt=true&orig_cvip=true&rt=nc,2 pieces: sog twitch ii lockback & sog bladelightmini folding pocket knife lot,2022-10-20,44.0,0.0,44.0,26.0,173.33333333333334,sog,15.0
https://i.ebayimg.com/images/g/T0wAAOSw9pVjN2CB/s-l1200.jpg,https://www.ebay.com/itm/115555815228?nordt=true&orig_cvip=true&rt=nc,sog salute mini tactical all black straight edge lockback pocket knife,2022-10-20,16.0,5.0,21.0,3.0,20.0,sog,15.0
https://i.ebayimg.com/images/g/nKMAAOSwnddjNOtY/s-l1200.jpg,https://www.ebay.com/itm/115559624482?nordt=true&orig_cvip=true&rt=nc,sog salute tactical all black straight edge lockback folding pocket knife,2022-10-20,12.5,7.47,19.97,1.9699999999999989,13.133333333333324,sog,15.0
https://i.ebayimg.com/images/g/wIkAAOSwFpNjP0ky/s-l1200.jpg,https://www.ebay.com/itm/115555099208?nordt=true&orig_cvip=true&rt=nc,sog flare 8cr13mov stainless steel straight edge assisted folding pocket knife,2022-10-20,29.0,5.0,34.0,16.0,106.66666666666667,sog,15.0
https://i.ebayimg.com/images/g/~IsAAOSwR1hjSKh~/s-l1200.jpg,https://www.ebay.com/itm/155207657759?nordt=true&orig_cvip=true&rt=nc,sog twitch ii 'limited edition' single  black blade folding pocket knife!,2022-10-20,40.0,6.1,46.1,28.1,187.33333333333334,sog,15.0
https://i.ebayimg.com/images/g/W-gAAOSwZdljS0NQ/s-l1200.jpg,https://www.ebay.com/itm/354336061047?nordt=true&orig_cvip=true&rt=nc,sog trident assisted open knife combo edge blade arc lock,2022-10-20,55.0,0.0,55.0,37.0,246.66666666666669,sog,15.0
https://i.ebayimg.com/images/g/L74AAOSwcPJjPvhQ/s-l1200.jpg,https://www.ebay.com/itm/285000788027?nordt=true&orig_cvip=true&rt=nc,sog powerlock multi tool knife nice,2022-10-20,43.99,0.0,43.99,25.990000000000002,173.26666666666668,sog,15.0
https://i.ebayimg.com/images/g/D4sAAOSwErdjPHEA/s-l1200.jpg,https://www.ebay.com/itm/165708452120?nordt=true&orig_cvip=true&rt=nc,"sog twitch ii assisted flipper pocket knife (2.65"" satin plain blade)",2022-10-20,25.0,11.94,36.94,18.939999999999998,126.26666666666667,sog,15.0
https://i.ebayimg.com/images/g/rroAAOSwmAtjG8oY/s-l1200.jpg,https://www.ebay.com/itm/265878196625?nordt=true&orig_cvip=true&rt=nc,vintage sog paratool folding knife multi tool pliers!,2022-10-20,44.97,0.0,44.97,26.97,179.79999999999998,sog,15.0
https://i.ebayimg.com/images/g/xp0AAOSwV3tjScLQ/s-l1200.jpg,https://www.ebay.com/itm/275500187588?nordt=true&orig_cvip=true&rt=nc,sog flash ii pocket knife - assisted opening - nice condition,2022-10-20,42.95,0.0,42.95,24.950000000000003,166.33333333333334,sog,15.0
https://i.ebayimg.com/images/g/-TwAAOSwpsRjMRgL/s-l1200.jpg,https://www.ebay.com/itm/204102702574?nordt=true&orig_cvip=true&rt=nc,black sog trident folding pocket knife used,2022-10-20,42.49,0.0,42.49,24.490000000000002,163.26666666666668,sog,15.0
https://i.ebayimg.com/images/g/pIAAAOSwlgRjQ3ms/s-l1200.jpg,https://www.ebay.com/itm/155213660630?nordt=true&orig_cvip=true&rt=nc,s.o.g. fielder g10 stainless lock-back folding knife used good!!!,2022-10-20,19.99,5.0,24.99,6.989999999999998,46.599999999999994,sog,15.0
https://i.ebayimg.com/images/g/dp8AAOSwXM5jQeXw/s-l1200.jpg,https://www.ebay.com/itm/265926058459?nordt=true&orig_cvip=true&rt=nc,sog fatcat knife great condition,2022-10-20,330.0,10.0,340.0,322.0,2146.6666666666665,sog,15.0
https://i.ebayimg.com/images/g/2pkAAOSwtvNjTYDn/s-l1200.jpg,https://www.ebay.com/itm/334596224578?nordt=true&orig_cvip=true&rt=nc,sog flash ii assisted folding pocket knife plain edge free express shipping,2022-10-19,40.0,0.0,40.0,22.0,146.66666666666666,sog,15.0
https://i.ebayimg.com/images/g/65sAAOSwtS1jR3EZ/s-l1200.jpg,https://www.ebay.com/itm/134277728291?nordt=true&orig_cvip=true&rt=nc,sog centi i & 2  folding knife,2022-10-19,3.0,5.3,8.3,-9.7,-64.66666666666666,sog,15.0
https://i.ebayimg.com/images/g/Oe4AAOSwFytjR1~0/s-l1200.jpg,https://www.ebay.com/itm/225203289405?nordt=true&orig_cvip=true&rt=nc,sog cash card 8cr13mov liner lock folding pocket edc knife money clip,2022-10-19,15.5,3.73,19.23,1.2300000000000004,8.200000000000003,sog,15.0
https://i.ebayimg.com/images/g/n2AAAOSwVlFjM5q9/s-l1200.jpg,https://www.ebay.com/itm/155189179012?nordt=true&orig_cvip=true&rt=nc,1 sog flash11   knife excellent new other   lot u27,2022-10-19,45.75,6.0,51.75,33.75,225.0,sog,15.0
https://i.ebayimg.com/images/g/b~IAAOSwEaJjRtxw/s-l1200.jpg,https://www.ebay.com/itm/144763907110?nordt=true&orig_cvip=true&rt=nc,sog knifes (lot of 10),2022-10-19,182.5,10.4,192.9,174.9,1166.0,sog,15.0
https://i.ebayimg.com/images/g/eRIAAOSwptdjDk~G/s-l1200.jpg,https://www.ebay.com/itm/115510243806?nordt=true&orig_cvip=true&rt=nc,sog flash ii folding knife,2022-10-19,30.0,0.0,30.0,12.0,80.0,sog,15.0
https://i.ebayimg.com/images/g/YI0AAOSwS~tjThse/s-l1200.jpg,https://www.ebay.com/itm/255781854593?nordt=true&orig_cvip=true&rt=nc,sog trident black assisted opening folding knife serrated blade,2022-10-18,45.0,0.0,45.0,27.0,180.0,sog,15.0
https://i.ebayimg.com/images/g/cvIAAOSwAHljP5wE/s-l1200.jpg,https://www.ebay.com/itm/394276626352?nordt=true&orig_cvip=true&rt=nc,black sog trident folding pocket knife used e,2022-10-18,34.99,0.0,34.99,16.990000000000002,113.26666666666667,sog,15.0
https://i.ebayimg.com/images/g/5kQAAOSw0ABjROTq/s-l1200.jpg,https://www.ebay.com/itm/225200335274?nordt=true&orig_cvip=true&rt=nc,sog twitch xl tactical lock blade knife - mib w/ papers,2022-10-18,46.0,9.5,55.5,37.5,250.0,sog,15.0
https://i.ebayimg.com/images/g/tRUAAOSwGJxjI43K/s-l1200.jpg,https://www.ebay.com/itm/155207488791?nordt=true&orig_cvip=true&rt=nc,sog trident tanto assisted open knife plain edge blade arc lock,2022-10-18,25.0,5.5,30.5,12.5,83.33333333333334,sog,15.0
https://i.ebayimg.com/images/g/FzAAAOSw9~5jFNKP/s-l1200.jpg,https://www.ebay.com/itm/374240937364?nordt=true&orig_cvip=true&rt=nc,"rare-discontinued sog autoclip folding pocket knife 3"" blade b1239",2022-10-18,35.0,0.0,35.0,17.0,113.33333333333333,sog,15.0
https://i.ebayimg.com/images/g/AEYAAOSwhLFjStnb/s-l1200.jpg,https://www.ebay.com/itm/354335472714?nordt=true&orig_cvip=true&rt=nc,"sog folding knife slimjim a/o lockback 7 3/4"" overall",2022-10-18,25.0,5.3,30.3,12.3,82.0,sog,15.0
https://i.ebayimg.com/images/g/8iMAAOSw~YtjLIIN/s-l1200.jpg,https://www.ebay.com/itm/385130052860?nordt=true&orig_cvip=true&rt=nc,sog black g10 sog salute lockback knife very cool!! ��1069,2022-10-18,23.0,0.0,23.0,5.0,33.33333333333333,sog,15.0
https://i.ebayimg.com/images/g/26gAAOSwlbJjRaLX/s-l1200.jpg,,,2022-10-18,86.0,9.9,95.9,77.9,519.3333333333334,sog,15.0
https://i.ebayimg.com/images/g/JDIAAOSwu6pjRaBI/s-l1200.jpg,,,2022-10-18,107.0,9.9,116.9,98.9,659.3333333333334,sog,15.0
https://i.ebayimg.com/images/g/XCcAAOSwVPRjRZ9D/s-l1200.jpg,,,2022-10-18,40.0,9.9,49.9,31.9,212.66666666666666,sog,15.0
https://i.ebayimg.com/images/g/~RYAAOSwPWJjRZUJ/s-l1200.jpg,https://www.ebay.com/itm/195408079118?nordt=true&orig_cvip=true&rt=nc,sog paratool multi tool pliers knife file made in usa,2022-10-18,32.51,8.27,40.78,22.78,151.86666666666667,sog,15.0
https://i.ebayimg.com/images/g/WVcAAOSwGhNjTaq2/s-l1200.jpg,https://www.ebay.com/itm/185622125677?nordt=true&orig_cvip=true&rt=nc,"sog vision xr folding knife 3.38"" cts-xhp steel tanto blade black g10 handle",2022-10-18,80.0,5.99,85.99,67.99,453.26666666666665,sog,15.0
https://i.ebayimg.com/images/g/mNoAAOSw1dhjRxCL/s-l1200.png,https://www.ebay.com/itm/403936271494?nordt=true&orig_cvip=true&rt=nc,sog powerlock pocket survival tool knife folding pliers blade compound leverage,2022-10-17,26.0,0.0,26.0,8.0,53.333333333333336,sog,15.0
